{
  "artifact_id": "mas_alla_del_guion",
  "artifact_version": "1.2.2",
  "checked_at": "2026-08-29T09:39:14Z",
  "checker_version": "1.2.2",
  "evidence": {
    "profile_checksum": "c4175417681eb0bc8626a8ae6933cda8cfb3f3645ce138b0e9cdbd59cf59dff9",
    "approval_checksum": "c4175417681eb0bc8626a8ae6933cda8cfb3f3645ce138b0e9cdbd59cf59dff9",
    "voice_evidence_level": "AUTHENTIC_CORPUS_PARTIAL",
      "lineage_sources": [
        "B3-FUNCTIONAL-SPEC-CANONICAL"
      ],
    "corpus_status": "AUTHENTIC_CORPUS_PARTIAL",
    "global_voice_representativeness": "NOT_VALIDATED",
    "active_pointer_target": null,
    "functional_source": {
      "source_id": "B3-FUNCTIONAL-SPEC-CANONICAL",
      "role": "FUNCTIONAL_SPECIFICATION",
      "checksum": "899478a6b5be428bca3b8038c3878225f26ae6107aef4f911e69cfe45440265d"
    },
    "validated_profile_checksum": "c4175417681eb0bc8626a8ae6933cda8cfb3f3645ce138b0e9cdbd59cf59dff9",
    "functional_approval_verified": true,
    "owner_approval_verified": true,
    "voice_corpus_state": "AUTHENTIC_CORPUS_PARTIAL"
  },
  "exit_code": 0,
  "gate_id": "B3_TECHNICAL_PROFILE_VALIDATION",
  "status": "PASS",
  "summary": "Perfil editorial 1.2.2 validado tecnicamente para activacion canonica: checksum exacto verificado, aprobacion funcional del propietario registrada, lineage limitado a la especificacion canónica y corpus autentico parcial mantenido sin validacion global de representatividad.",
  "violations": [],
  "warnings": [
    "VOICE_CORPUS_STATE = AUTHENTIC_CORPUS_PARTIAL",
    "GLOBAL_VOICE_REPRESENTATIVENESS = NOT_VALIDATED"
  ]
}
