{
  "artifact_id": "mas_alla_del_guion",
  "artifact_version": "1.1.0",
  "checked_at": "2026-07-23T14:34:45.801407+00:00",
  "checker_version": "1.1.0",
  "evidence": {
    "corpus_status": "SPECIFICATION_BASED",
    "implemented_request_changes": [
      "RC-01",
      "RC-02",
      "RC-03",
      "RC-04",
      "RC-05",
      "RC-06"
    ],
    "profile_checksum": "dbe94dbfcee5e9e30a956dab20097f62216e4fb58beddb3ef8fa3086fd95ee8c",
    "voice_evidence_level": "SPECIFICATION_BASED"
  },
  "exit_code": 0,
  "gate_id": "B3_TECHNICAL_PROFILE_VALIDATION",
  "status": "PASS",
  "summary": "Perfil editorial 1.1.0 validado contra la sede canónica activa y compilado de forma reproducible.",
  "violations": [],
  "warnings": []
}
