{
  "artifact_id": "mas_alla_del_guion",
  "artifact_version": "1.2.1",
  "checked_at": "2026-07-29T00:00:00Z",
  "checker_version": "1.2.1",
  "evidence": {
    "profile_checksum": "d0355ea43f1d46f6ec94499bd81ae2f99c48f11e4402d1604c634abde70d48f1",
    "approval_checksum": "d0355ea43f1d46f6ec94499bd81ae2f99c48f11e4402d1604c634abde70d48f1",
    "voice_evidence_level": "AUTHENTIC_CORPUS_PARTIAL",
    "lineage_sources": [
      "B3-FUNCTIONAL-SPEC-CANONICAL",
      "EDITORIAL-PROFILE-MAS-ALLA-DEL-GUION-1.1.0"
    ],
    "supersedes_profile": "mas_alla_del_guion@1.2.0",
    "corpus_status": "AUTHENTIC_CORPUS_PARTIAL",
    "global_voice_representativeness": "NOT_VALIDATED",
    "active_pointer_target": null,
    "functional_source": {
      "source_id": "B3-FUNCTIONAL-SPEC-CANONICAL",
      "role": "FUNCTIONAL_SPECIFICATION",
      "checksum": "c2108e34fa5113e22c01dc70888e8e510eede12c7b54ccff76bd810045a6aadc"
    },
    "migration_source_profile": "mas_alla_del_guion@1.1.0",
    "superseded_profile": "mas_alla_del_guion@1.2.0",
    "validated_profile_checksum": "d0355ea43f1d46f6ec94499bd81ae2f99c48f11e4402d1604c634abde70d48f1",
    "functional_approval_verified": true,
    "owner_approval_verified": true,
    "voice_corpus_state": "AUTHENTIC_CORPUS_PARTIAL"
  },
  "exit_code": 0,
  "gate_id": "B3_TECHNICAL_PROFILE_VALIDATION",
  "status": "PASS",
  "summary": "Perfil editorial 1.2.1 validado tecnicamente para activacion canonica: checksum exacto preservado, aprobacion funcional verificada, aprobacion del propietario registrada y corpus autentico parcial mantenido sin validacion global de representatividad.",
  "violations": [],
  "warnings": [
    "VOICE_CORPUS_STATE = AUTHENTIC_CORPUS_PARTIAL",
    "GLOBAL_VOICE_REPRESENTATIVENESS = NOT_VALIDATED"
  ]
}
