{
  "artifact_id": "mas_alla_del_guion",
  "artifact_version": "1.2.0",
  "checked_at": "2026-07-27T12:15:00Z",
  "checker_version": "1.2.0",
  "evidence": {
    "profile_checksum": "b1029e85289c51d4585c555ed20566dfd6f1f6db30b875f989fc23bf46fc5977",
    "approval_checksum": "b1029e85289c51d4585c555ed20566dfd6f1f6db30b875f989fc23bf46fc5977",
    "voice_evidence_level": "AUTHENTIC_CORPUS_PARTIAL",
    "lineage_sources": [
      "B3-FUNCTIONAL-SPEC-CANONICAL",
      "EDITORIAL-PROFILE-MAS-ALLA-DEL-GUION-1.1.0"
    ],
    "replaces_invalid_profile": "mas_alla_del_guion@1.1.0",
    "active_pointer_target": null
  },
  "exit_code": 1,
  "gate_id": "B3_TECHNICAL_PROFILE_VALIDATION",
  "status": "BLOCKED",
  "summary": "Perfil editorial 1.2.0 coherente con schema, lineage, corpus auténtico parcial y checksum final, pero bloqueado para activación hasta recibir aprobación funcional válida.",
  "violations": [
    "No existe aprobación funcional válida para activar la versión 1.2.0."
  ],
  "warnings": []
}
